{
  "id": "artifact-approved-policy-export-synthetic",
  "object_type": "document_artifact",
  "title": "Approved Export Of Quarterly Access Review Policy",
  "description": "A synthetic approved PDF export that represents the active access review policy record.",
  "artifact_role": "approved_export",
  "lifecycle_status": "active",
  "authority_status": "controlled_representation",
  "represented_knowledge_object": "policy-access-review-v2-synthetic",
  "storage_location": {
    "system_id": "system-policy-management-synthetic",
    "system_name": "Synthetic Policy Management System",
    "repository_type": "policy_management_system"
  },
  "source_uri": "https://policy-management.example.invalid/artifacts/access-review-policy-v2-export.pdf",
  "version": "v2.0",
  "effective_from": "2026-01-01",
  "effective_to": null,
  "captured_date": "2026-01-01",
  "media_type": "application/pdf",
  "provenance": {
    "created_by": "author-policy-office-synthetic",
    "created_at": "2026-01-01",
    "derivation": "synthetic_export",
    "source_record_url": "https://governance.example.invalid/policies/policy-access-review-v2-synthetic",
    "change_summary": "Synthetic export generated from the approved access review policy record."
  },
  "permissions": {
    "classification": "public_example",
    "permitted_uses": [
      "architecture_reference",
      "schema_validation",
      "synthetic_demo",
      "policy_interpretation",
      "control_requirement_evaluation",
      "workflow_selection",
      "copy_verification"
    ],
    "prohibited_uses": [
      "production_decisioning",
      "production_compliance_attestation",
      "external_distribution"
    ],
    "handling_notes": "Synthetic approved export. It represents the active policy object but does not replace the source authority."
  },
  "content_fingerprint": {
    "algorithm": "sha-256",
    "value": "0a42f7a4ebb2d70a53e52d2a8ff49e7f3ce6083639ffc5a2d9ecd244305a028d",
    "fingerprinted_field": "example_content",
    "notes": "Computed from the UTF-8 bytes of example_content in this repository file."
  },
  "verification": {
    "status": "verified",
    "verified_by": "steward-access-governance-synthetic",
    "verified_date": "2026-01-01",
    "method": "Export generated by the synthetic policy management system from the approved policy record.",
    "notes": "Verified as the approved export for the active policy version."
  },
  "related_objects": [
    {
      "id": "policy-access-review-v2-synthetic",
      "relationship_type": "represents"
    }
  ],
  "related_artifacts": [],
  "example_content": "Synthetic Access Review Policy v2.0\nEffective: 2026-01-01\nAuthority: Synthetic Policy Standards Board\nRequirement: Privileged and business-critical access must be reviewed at least quarterly by an accountable owner.\n"
}
