{
  "id": "artifact-obsolete-policy-copy-synthetic",
  "object_type": "document_artifact",
  "title": "Obsolete Collaboration Copy Of Access Review Policy",
  "description": "A synthetic collaboration repository copy that represents a superseded access review policy version.",
  "artifact_role": "uncontrolled_copy",
  "lifecycle_status": "superseded",
  "authority_status": "superseded",
  "represented_knowledge_object": "policy-access-review-v1-synthetic",
  "storage_location": {
    "system_id": "system-collaboration-repository-synthetic",
    "system_name": "Synthetic Collaboration Repository",
    "repository_type": "collaboration_repository"
  },
  "source_uri": "https://collaboration.example.invalid/policies/access-review-policy-v1-copy.pdf",
  "version": "v1.0",
  "effective_from": "2025-01-01",
  "effective_to": "2025-12-31",
  "captured_date": "2025-02-01",
  "media_type": "application/pdf",
  "provenance": {
    "created_by": "author-policy-office-synthetic",
    "created_at": "2025-02-01",
    "derivation": "synthetic_copy",
    "source_record_url": "https://governance.example.invalid/policies/policy-access-review-v1-synthetic",
    "change_summary": "Synthetic copy retained after policy version 1 was superseded."
  },
  "permissions": {
    "classification": "public_example",
    "permitted_uses": [
      "architecture_reference",
      "schema_validation",
      "synthetic_demo"
    ],
    "prohibited_uses": [
      "policy_interpretation",
      "control_requirement_evaluation",
      "production_decisioning",
      "production_compliance_attestation",
      "external_distribution"
    ],
    "handling_notes": "Synthetic obsolete copy. It can show history but cannot control a decision after its effective period."
  },
  "content_fingerprint": {
    "algorithm": "sha-256",
    "value": "35816fbfda8e96d4c6f4223d4f49942527483277221418f23a13f30f0063ebe4",
    "fingerprinted_field": "example_content",
    "notes": "Computed from the UTF-8 bytes of example_content in this repository file."
  },
  "verification": {
    "status": "expired",
    "verified_by": "steward-knowledge-management-synthetic",
    "verified_date": "2026-01-02",
    "method": "Version metadata comparison against the active policy record.",
    "notes": "The copy represents policy version 1, which was superseded by version 2 on 2026-01-01."
  },
  "related_objects": [
    {
      "id": "policy-access-review-v1-synthetic",
      "relationship_type": "represents"
    },
    {
      "id": "policy-access-review-v2-synthetic",
      "relationship_type": "references"
    }
  ],
  "related_artifacts": [],
  "example_content": "Synthetic Access Review Policy v1.0\nEffective: 2025-01-01 through 2025-12-31\nAuthority: Synthetic Policy Standards Board\nRequirement: Access to regulated systems must be reviewed periodically.\n"
}
