{
  "id": "artifact-verified-policy-copy-synthetic",
  "object_type": "document_artifact",
  "title": "Verified Collaboration Copy Of Quarterly Access Review Policy",
  "description": "A synthetic collaboration repository copy verified as an exact copy of the approved policy export.",
  "artifact_role": "verified_copy",
  "lifecycle_status": "active",
  "authority_status": "verified_replica",
  "represented_knowledge_object": "policy-access-review-v2-synthetic",
  "storage_location": {
    "system_id": "system-collaboration-repository-synthetic",
    "system_name": "Synthetic Collaboration Repository",
    "repository_type": "collaboration_repository"
  },
  "source_uri": "https://collaboration.example.invalid/policies/access-review-policy-v2-copy.pdf",
  "version": "v2.0",
  "effective_from": "2026-01-01",
  "effective_to": null,
  "captured_date": "2026-01-02",
  "media_type": "application/pdf",
  "provenance": {
    "created_by": "steward-access-governance-synthetic",
    "created_at": "2026-01-02",
    "derivation": "synthetic_copy",
    "source_record_url": "https://policy-management.example.invalid/artifacts/access-review-policy-v2-export.pdf",
    "change_summary": "Synthetic collaboration repository copy of the approved export."
  },
  "permissions": {
    "classification": "public_example",
    "permitted_uses": [
      "architecture_reference",
      "schema_validation",
      "synthetic_demo",
      "copy_verification"
    ],
    "prohibited_uses": [
      "production_decisioning",
      "production_compliance_attestation",
      "external_distribution"
    ],
    "handling_notes": "Synthetic verified replica. The matching hash verifies byte identity with the approved export but does not make this repository the authority."
  },
  "content_fingerprint": {
    "algorithm": "sha-256",
    "value": "0a42f7a4ebb2d70a53e52d2a8ff49e7f3ce6083639ffc5a2d9ecd244305a028d",
    "fingerprinted_field": "example_content",
    "notes": "Computed from the UTF-8 bytes of example_content in this repository file; the value matches the approved export."
  },
  "verification": {
    "status": "verified",
    "verified_by": "steward-knowledge-management-synthetic",
    "verified_date": "2026-01-02",
    "method": "SHA-256 comparison against the approved export example_content.",
    "notes": "Verified as an exact byte copy for the content represented in this public example."
  },
  "related_objects": [
    {
      "id": "policy-access-review-v2-synthetic",
      "relationship_type": "represents"
    }
  ],
  "related_artifacts": [
    {
      "id": "artifact-approved-policy-export-synthetic",
      "relationship_type": "exact_copy_of"
    }
  ],
  "example_content": "Synthetic Access Review Policy v2.0\nEffective: 2026-01-01\nAuthority: Synthetic Policy Standards Board\nRequirement: Privileged and business-critical access must be reviewed at least quarterly by an accountable owner.\n"
}
